{
  "schema": "teistro-conformance/baseline-kalachakra/1",
  "fixture": "charts/c043-fairbanks-2015-06-21.json",
  "provenance": {
    "source": "baseline-engine",
    "evidence_rank": 2,
    "engine_version": "1.8.0",
    "exporter_version": "1.0.0",
    "inputs": "the fixture's recorded dashas.moon_sidereal_longitude_deg, input.resolved.jd_ut and, per method, dashas.methods.*.nakshatra_span"
  },
  "year_length_days": 365.25,
  "moon_sidereal_longitude_deg": 121.8569180498829,
  "nakshatra_index": 9,
  "pada_index": 0,
  "reference_instants_jd": [2467194.875, 2461287.5],
  "methods": {
    "spatial": {
      "balance": {
        "years": 4,
        "months": 5,
        "days": 4,
        "hours": 14,
        "minutes": 16,
        "total_days": 1617.7820468408124
      },
      "tree_depth": 2,
      "row_format": ["path", "sign_index", "lord", "start_jd", "end_jd"],
      "periods": [
        ["0", 8, "JUPITER", 2457194.875, 2458812.657046841],
        ["0/0", 8, "JUPITER", 2457194.875, 2457382.989191493],
        ["0/1", 9, "SATURN", 2457382.989191493, 2457458.23486809],
        ["0/2", 10, "SATURN", 2457458.23486809, 2457533.4805446877],
        ["0/3", 11, "JUPITER", 2457533.4805446877, 2457721.5947361807],
        ["0/4", 0, "MARS", 2457721.5947361807, 2457853.274670226],
        ["0/5", 1, "VENUS", 2457853.274670226, 2458154.257376615],
        ["0/6", 2, "MERCURY", 2458154.257376615, 2458323.5601489586],
        ["0/7", 4, "SUN", 2458323.5601489586, 2458417.617244705],
        ["0/8", 3, "MOON", 2458417.617244705, 2458812.657046841],
        ["1", 9, "SATURN", 2458812.657046841, 2460273.657046841],
        ["1/0", 9, "SATURN", 2458812.657046841, 2458880.6105352133],
        ["1/1", 10, "SATURN", 2458880.6105352133, 2458948.564023585],
        ["1/2", 11, "JUPITER", 2458948.564023585, 2459118.4477445153],
        ["1/3", 0, "MARS", 2459118.4477445153, 2459237.3663491667],
        ["1/4", 1, "VENUS", 2459237.3663491667, 2459509.180302655],
        ["1/5", 2, "MERCURY", 2459509.180302655, 2459662.075651492],
        ["1/6", 4, "SUN", 2459662.075651492, 2459747.0175119573],
        ["1/7", 3, "MOON", 2459747.0175119573, 2460103.773325911],
        ["1/8", 8, "JUPITER", 2460103.773325911, 2460273.657046841],
        ["2", 10, "SATURN", 2460273.657046841, 2461734.657046841],
        ["2/0", 10, "SATURN", 2460273.657046841, 2460341.6105352133],
        ["2/1", 11, "JUPITER", 2460341.6105352133, 2460511.4942561435],
        ["2/2", 0, "MARS", 2460511.4942561435, 2460630.4128607945],
        ["2/3", 1, "VENUS", 2460630.4128607945, 2460902.226814283],
        ["2/4", 2, "MERCURY", 2460902.226814283, 2461055.12216312],
        ["2/5", 4, "SUN", 2461055.12216312, 2461140.064023585],
        ["2/6", 3, "MOON", 2461140.064023585, 2461496.8198375385],
        ["2/7", 8, "JUPITER", 2461496.8198375385, 2461666.7035584687],
        ["2/8", 9, "SATURN", 2461666.7035584687, 2461734.657046841],
        ["3", 11, "JUPITER", 2461734.657046841, 2465387.157046841],
        ["3/0", 11, "JUPITER", 2461734.657046841, 2462159.3663491667],
        ["3/1", 0, "MARS", 2462159.3663491667, 2462456.6628607945],
        ["3/2", 1, "VENUS", 2462456.6628607945, 2463136.1977445153],
        ["3/3", 2, "MERCURY", 2463136.1977445153, 2463518.4361166083],
        ["3/4", 4, "SUN", 2463518.4361166083, 2463730.790767771],
        ["3/5", 3, "MOON", 2463730.790767771, 2464622.680302655],
        ["3/6", 8, "JUPITER", 2464622.680302655, 2465047.3896049806],
        ["3/7", 9, "SATURN", 2465047.3896049806, 2465217.273325911],
        ["3/8", 10, "SATURN", 2465217.273325911, 2465387.157046841],
        ["4", 0, "MARS", 2465387.157046841, 2467943.907046841],
        ["4/0", 0, "MARS", 2465387.157046841, 2465595.2646049806],
        ["4/1", 1, "VENUS", 2465595.2646049806, 2466070.939023585],
        ["4/2", 2, "MERCURY", 2466070.939023585, 2466338.5058840504],
        ["4/3", 4, "SUN", 2466338.5058840504, 2466487.1541398643],
        ["4/4", 3, "MOON", 2466487.1541398643, 2467111.476814283],
        ["4/5", 8, "JUPITER", 2467111.476814283, 2467408.773325911],
        ["4/6", 9, "SATURN", 2467408.773325911, 2467527.691930562],
        ["4/7", 10, "SATURN", 2467527.691930562, 2467646.6105352133],
        ["4/8", 11, "JUPITER", 2467646.6105352133, 2467943.907046841],
        ["5", 1, "VENUS", 2467943.907046841, 2473787.907046841],
        ["5/0", 1, "VENUS", 2467943.907046841, 2469031.1628607945],
        ["5/1", 2, "MERCURY", 2469031.1628607945, 2469642.7442561435],
        ["5/2", 4, "SUN", 2469642.7442561435, 2469982.511698004],
        ["5/3", 3, "MOON", 2469982.511698004, 2471409.5349538177],
        ["5/4", 8, "JUPITER", 2471409.5349538177, 2472089.0698375385],
        ["5/5", 9, "SATURN", 2472089.0698375385, 2472360.883791027],
        ["5/6", 10, "SATURN", 2472360.883791027, 2472632.6977445153],
        ["5/7", 11, "JUPITER", 2472632.6977445153, 2473312.2326282365],
        ["5/8", 0, "MARS", 2473312.2326282365, 2473787.907046841],
        ["6", 2, "MERCURY", 2473787.907046841, 2477075.157046841],
        ["6/0", 2, "MERCURY", 2473787.907046841, 2474131.9215817247],
        ["6/1", 4, "SUN", 2474131.9215817247, 2474323.040767771],
        ["6/2", 3, "MOON", 2474323.040767771, 2475125.7413491667],
        ["6/3", 8, "JUPITER", 2475125.7413491667, 2475507.97972126],
        ["6/4", 9, "SATURN", 2475507.97972126, 2475660.875070097],
        ["6/5", 10, "SATURN", 2475660.875070097, 2475813.770418934],
        ["6/6", 11, "JUPITER", 2475813.770418934, 2476196.008791027],
        ["6/7", 0, "MARS", 2476196.008791027, 2476463.575651492],
        ["6/8", 1, "VENUS", 2476463.575651492, 2477075.157046841],
        ["7", 4, "SUN", 2477075.157046841, 2478901.407046841],
        ["7/0", 4, "SUN", 2477075.157046841, 2477181.334372422],
        ["7/1", 3, "MOON", 2477181.334372422, 2477627.2791398643],
        ["7/2", 8, "JUPITER", 2477627.2791398643, 2477839.633791027],
        ["7/3", 9, "SATURN", 2477839.633791027, 2477924.575651492],
        ["7/4", 10, "SATURN", 2477924.575651492, 2478009.5175119573],
        ["7/5", 11, "JUPITER", 2478009.5175119573, 2478221.87216312],
        ["7/6", 0, "MARS", 2478221.87216312, 2478370.520418934],
        ["7/7", 1, "VENUS", 2478370.520418934, 2478710.2878607945],
        ["7/8", 2, "MERCURY", 2478710.2878607945, 2478901.407046841],
        ["8", 3, "MOON", 2478901.407046841, 2486571.657046841],
        ["8/0", 3, "MOON", 2478901.407046841, 2480774.375070097],
        ["8/1", 8, "JUPITER", 2480774.375070097, 2481666.2646049806],
        ["8/2", 9, "SATURN", 2481666.2646049806, 2482023.020418934],
        ["8/3", 10, "SATURN", 2482023.020418934, 2482379.7762328875],
        ["8/4", 11, "JUPITER", 2482379.7762328875, 2483271.665767771],
        ["8/5", 0, "MARS", 2483271.665767771, 2483895.98844219],
        ["8/6", 1, "VENUS", 2483895.98844219, 2485323.011698004],
        ["8/7", 2, "MERCURY", 2485323.011698004, 2486125.712279399],
        ["8/8", 4, "SUN", 2486125.712279399, 2486571.657046841],
        ["9", 3, "MOON", 2486571.657046841, 2494241.907046841],
        ["9/0", 3, "MOON", 2486571.657046841, 2488444.625070097],
        ["9/1", 4, "SUN", 2488444.625070097, 2488890.5698375385],
        ["9/2", 2, "MERCURY", 2488890.5698375385, 2489693.270418934],
        ["9/3", 1, "VENUS", 2489693.270418934, 2491120.293674748],
        ["9/4", 0, "MARS", 2491120.293674748, 2491744.6163491667],
        ["9/5", 11, "JUPITER", 2491744.6163491667, 2492636.5058840504],
        ["9/6", 10, "SATURN", 2492636.5058840504, 2492993.261698004],
        ["9/7", 9, "SATURN", 2492993.261698004, 2493350.0175119573],
        ["9/8", 8, "JUPITER", 2493350.0175119573, 2494241.907046841],
        ["10", 4, "SUN", 2494241.907046841, 2496068.157046841],
        ["10/0", 4, "SUN", 2494241.907046841, 2494348.084372422],
        ["10/1", 2, "MERCURY", 2494348.084372422, 2494539.2035584687],
        ["10/2", 1, "VENUS", 2494539.2035584687, 2494878.9710003296],
        ["10/3", 0, "MARS", 2494878.9710003296, 2495027.6192561435],
        ["10/4", 11, "JUPITER", 2495027.6192561435, 2495239.9739073063],
        ["10/5", 10, "SATURN", 2495239.9739073063, 2495324.915767771],
        ["10/6", 9, "SATURN", 2495324.915767771, 2495409.8576282365],
        ["10/7", 8, "JUPITER", 2495409.8576282365, 2495622.212279399],
        ["10/8", 3, "MOON", 2495622.212279399, 2496068.157046841],
        ["11", 2, "MERCURY", 2496068.157046841, 2499355.407046841],
        ["11/0", 2, "MERCURY", 2496068.157046841, 2496412.1715817247],
        ["11/1", 1, "VENUS", 2496412.1715817247, 2497023.7529770737],
        ["11/2", 0, "MARS", 2497023.7529770737, 2497291.3198375385],
        ["11/3", 11, "JUPITER", 2497291.3198375385, 2497673.5582096316],
        ["11/4", 10, "SATURN", 2497673.5582096316, 2497826.4535584687],
        ["11/5", 9, "SATURN", 2497826.4535584687, 2497979.3489073063],
        ["11/6", 8, "JUPITER", 2497979.3489073063, 2498361.587279399],
        ["11/7", 3, "MOON", 2498361.587279399, 2499164.2878607945],
        ["11/8", 4, "SUN", 2499164.2878607945, 2499355.407046841],
        ["12", 1, "VENUS", 2499355.407046841, 2505199.407046841],
        ["12/0", 1, "VENUS", 2499355.407046841, 2500442.6628607945],
        ["12/1", 0, "MARS", 2500442.6628607945, 2500918.337279399],
        ["12/2", 11, "JUPITER", 2500918.337279399, 2501597.87216312],
        ["12/3", 10, "SATURN", 2501597.87216312, 2501869.6861166083],
        ["12/4", 9, "SATURN", 2501869.6861166083, 2502141.500070097],
        ["12/5", 8, "JUPITER", 2502141.500070097, 2502821.0349538177],
        ["12/6", 3, "MOON", 2502821.0349538177, 2504248.0582096316],
        ["12/7", 4, "SUN", 2504248.0582096316, 2504587.825651492],
        ["12/8", 2, "MERCURY", 2504587.825651492, 2505199.407046841],
        ["13", 0, "MARS", 2505199.407046841, 2507756.157046841],
        ["13/0", 0, "MARS", 2505199.407046841, 2505407.5146049806],
        ["13/1", 11, "JUPITER", 2505407.5146049806, 2505704.8111166083],